{
  "case_id": "adv_002_field_conflict",
  "category": "ai_adversarial",
  "description": "Adversarial label with conflicting ABV/proof or class statements in different regions.",
  "tags": ["adversarial", "field_conflict", "abv", "class_type"],
  "image_filename": "label.jpg",
  "expected_overall_status": "review",
  "expected_field_results": {
    "brand_name": "review",
    "class_type": "mismatch",
    "alcohol_content": "mismatch",
    "net_contents": "review",
    "bottler_producer": "review",
    "country_of_origin": "review",
    "government_warning": "review"
  },
  "application_data": {
    "brand_name": "Blue Ridge Reserve",
    "class_type": "Tequila",
    "alcohol_content": "40% Alc/Vol",
    "net_contents": "750 mL",
    "bottler_producer": "Blue Ridge Imports, Austin, TX",
    "country_of_origin": "Mexico",
    "government_warning": "GOVERNMENT WARNING: (1) According to the Surgeon General, women should not drink alcoholic beverages during pregnancy because of the risk of birth defects. (2) Consumption of alcoholic beverages impairs your ability to drive a car or operate machinery, and may cause health problems."
  },
  "input_hint": {
    "recommended_mode": "batch_compare_application",
    "batch_group": "adversarial",
    "notes": "Compare mode is best for exercising explicit field-conflict logic."
  },
  "reviewer_notes": "Expected outcome is reviewer escalation due to contradictory core compliance fields."
}
