{
  "case_id": "adv_001_warning_spoof",
  "category": "ai_adversarial",
  "description": "Adversarial label with warning-like text that is incomplete or semantically altered.",
  "tags": ["adversarial", "warning", "spoof", "risk"],
  "image_filename": "label.jpg",
  "expected_overall_status": "review",
  "expected_field_results": {
    "brand_name": "review",
    "class_type": "review",
    "alcohol_content": "review",
    "net_contents": "review",
    "bottler_producer": "review",
    "country_of_origin": "review",
    "government_warning": "mismatch"
  },
  "application_data": {
    "brand_name": "Demo Harbor",
    "class_type": "Gin",
    "alcohol_content": "42% Alc/Vol",
    "net_contents": "750 mL",
    "bottler_producer": "Demo Harbor Distillers, Seattle, WA",
    "country_of_origin": "United States",
    "government_warning": "GOVERNMENT WARNING: (1) According to the Surgeon General, women should not drink alcoholic beverages during pregnancy because of the risk of birth defects. (2) Consumption of alcoholic beverages impairs your ability to drive a car or operate machinery, and may cause health problems."
  },
  "input_hint": {
    "recommended_mode": "compare_application",
    "batch_group": "adversarial",
    "notes": "Use to validate warning spoof detection and conservative reviewer routing."
  },
  "reviewer_notes": "System should not mark this fully compliant even if warning-like fragments appear."
}
